Company Name,Summary
Canada Wide Media,"Canada Wide Media Limited is an independently owned publishing company in Western Canada, based in Burnaby, British Columbia."
Canadian Bank Note Company,"The Canadian Bank Note Company (CBNC) is a Canadian security printing company. It is best known for holding the contract with the Bank of Canada to supply it with Canada's banknotes since 1935. The company's other clients include private businesses, national and sub-national governments, central ban"
Canadian Broadcasting Corporation,"The Canadian Broadcasting Corporation (French: Société Radio-Canada), branded as CBC/Radio-Canada, is a Canadian public broadcaster for both radio and television. It is a federal Crown corporation funded by the government. The English- and French-language service units of the corporation are commonl"
Canadian Hydro Developers,"Canadian Hydro Developers, Inc. was a Canadian company that operated 12 hydroelectric power sites, eight wind power sites and one biomass power site in Canada.
Canadian Hydro was founded by two brothers John and Ross Keating with Jack McCleary.  In 1989 Canadian Hydro had secured $1.3 million in equ"
Canadian Imperial Bank of Commerce,"The Canadian Imperial Bank of Commerce (CIBC; French: Banque Canadienne Impériale de Commerce) is a Canadian multinational banking and financial services corporation headquartered at CIBC Square in the Financial District of Toronto, Ontario. CIBC's Institution Number (or bank number) is 010, and its"
Canadian Light Source,"The Canadian Light Source (CLS) (French: Centre canadien de rayonnement synchrotron – CCRS) is Canada's national synchrotron light source facility, located on the grounds of the University of Saskatchewan in Saskatoon, Saskatchewan, Canada. The CLS has a third-generation 2.9 GeV storage ring, and th"
Canadian National Railway,"The Canadian National Railway Company (French: Compagnie des chemins de fer nationaux du Canada) (reporting mark CN) is a Canadian Class I freight railway headquartered in Montreal, Quebec, which serves Canada and the Midwestern and Southern United States.
CN is Canada's largest railway, in terms of"
Canadian Natural Resources,"Canadian Natural Resources Limited, or CNRL or Canadian Natural is a senior Canadian oil and natural gas company that operates primarily in the Western Canadian provinces of British Columbia, 
Alberta, Saskatchewan, and Manitoba, with offshore operations in the United Kingdom sector of the North Sea"
Canadian Oil Sands,"Canadian Oil Sands Limited was a Canadian company that generates income from its oil sands investment in the Syncrude Joint Venture. Syncrude operated an oil sands facility and produced crude oil through the mining of oil sands from ore deposits in the Athabasca region of northern Alberta, Canada.
I"
Canadian Pacific Railway Limited,"The Canadian Pacific Railway (reporting marks CP, CPAA, MILW, SOO), also known simply as Canadian Pacific and formerly as CP Rail (1968–1996), is a Canadian Class I railway incorporated in 1881. The railway is owned by Canadian Pacific Railway Limited, which began operations as legal owner in a corp"
Canadian Plasma Resources,"Canadian Plasma Resources (CPR) is a private, for-profit bio-pharmaceutical company based in Saskatoon, Saskatchewan, Canada. It was founded in 2012 and specializes in the collection of source plasma for further manufacturing and contract-manufacturing of plasma-based bio-pharmaceuticals with operat"
Canadian Steamship Lines,"Canada Steamship Lines (CSL) is a shipping company with headquarters in Montreal, Quebec, Canada. The business has been operating for well over a century and a half."
Canadian Tire,"Canadian Tire Corporation, Limited is a Canadian retail company which operates in the automotive, hardware, sports, leisure and housewares sectors. Its Canadian operations include: Canadian Tire (including Canadian Tire Petroleum gas stations and financial services subsidiary Canadian Tire Bank), Ma"
Canadian Tire Bank,"Canadian Tire Services Ltd. (CTSL), doing business as Canadian Tire Bank (French: Banque Canadian Tire), is the financial services subsidiary of the Canadian Tire retail chain. The bank is based in Oakville, Ontario, and has additional business operations in St. Catharines and Welland (which are als"
Canadian Western Bank,"Canadian Western Bank (CWB; French: Banque canadienne de l'Ouest), also operating as CWB Financial Group, is a Canadian bank based in Edmonton, Alberta. The bank serves clients both in Western Canada and in other provinces.
The CWB Financial Group, and is made up of 10 banking, lending, wealth and t"
Canadian Wheat Board,"The Canadian Wheat Board (French: Commission canadienne du blé) was a marketing board for wheat and barley in Western Canada. Established by the Parliament of Canada on 5 July 1935, its operation was governed by the Canadian Wheat Board Act as a mandatory producer marketing system for wheat and barl"
Canalta Hotels,"Canalta Hotels is a hotel chain in western Canada with 44 hotels in Alberta, Saskatchewan and Manitoba.  The family owned company is based out of Drumheller and primarily targets smaller towns in Western Canada catering to sports teams, weddings, meetings and work crews.In addition to operating hote"
Candente Copper,"Candente Copper is developing its flagship project Cañariaco, within which Cañariaco Norte, is the 10th largest late-stage copper resource in the world (over 9B pounds copper, 2.1M ounces of gold and 59.4M ounces of silver Measured and Indicated*) and 6th highest in grade (RFC Ambrian, December 2021"
Cangene Corp.,"Cangene Corporation was a biopharmaceutical company based in Winnipeg, Manitoba, Canada. It was founded in 1984 and specialized in hyperimmunes, contract manufacturing, biopharmaceuticals and biodefense.  Cangene was 61% owned by Canadian pharmaceutical giant Apotex and was publicly listed on the TS"
CanJet,"CanJet was a Canadian low-cost air carrier headquartered in Enfield, Nova Scotia and based at Halifax International Airport. In addition to initially flying scheduled passenger service, CanJet operated charter flights using its own brand as well as flying contract and ad hoc charters for other tour "
Canpotex,"Canpotex, short for Canadian Potash Exporters (reporting mark PTEX), is a Canadian potash exporting and marketing firm, incorporated in 1970 and operating since 1972. Based in Saskatchewan, Canpotex manages the entire Saskatchewan potash exporting industry (excluding Canadian and US sales), includin"
Canucks Sports & Entertainment,"Canucks Sports & Entertainment, previously known as Orca Bay Sports & Entertainment, is a Canadian sports and entertainment company in Vancouver, British Columbia that owns and operates the Vancouver Canucks of the National Hockey League, the Vancouver Warriors of the National Lacrosse League, and t"
Canwest,"Canwest Global Communications Corporation, which operated under the corporate name Canwest, was a major Canadian media conglomerate based in Winnipeg, Manitoba, with its head offices at Canwest Place.  It held radio, television broadcasting and publishing assets in several countries, primarily in Ca"
Capcom Vancouver,"Capcom Game Studio Vancouver, Inc. (formerly Blue Castle Games Inc.), more commonly known as Capcom Vancouver, was a Canadian video game developer owned by Capcom with minority stake partnership by Microsoft Studios. As Blue Castle Games, the company was the creator of several successful baseball sp"
Cargill Ltd.,"Cargill Limited, also known as Cargill Canada, is the Canadian subsidiary of the Minneapolis-based multinational agribusiness giant Cargill. Depending on the source, it employs approximately 8,000 or 4,000 people across Canada.
It is involved in meat, egg, and oilseed processing, livestock feed, gra"
Casavant Frères,"Casavant Frères is a Canadian organ building company in Saint-Hyacinthe, Quebec, which has been building pipe organs since 1879. As of 2014, the company has produced more than 3,900 organs."
Cascades,"Cascades or The Cascades may refer to:

Cascades, a series of waterfalls"
Catalyst Paper,"Catalyst Paper Corporation is a pulp and paper company based in  Richmond, British Columbia. It operates five pulp mills and paper mills, producing a combined 1.8 million tonnes of paper and 491,000 tonnes of market pulp annually. The mills mostly produce magazine paper and newsprint.
The company wa"
Celestica,"Celestica Inc. is a Canadian multinational electronics manufacturing services (EMS) company headquartered in Toronto, Ontario."
Cellcom Communications,"Cellcom Communications or Cellcom is a telecommunications company based in Montreal, Quebec and the largest franchisee of Bell Canada & Bell Mobility in North America with 42 stores across Ontario and Greater Montreal Area."
Cenovus Energy,"Cenovus Energy Inc. (pronounced se-nō-vus) is an integrated oil and natural gas company headquartered in Calgary, Alberta.
Cenovus was formed in 2009 when Encana Corporation split into two distinct companies, with Cenovus becoming focused on oil sands assets.
In 2017, Cenovus purchased ConocoPhillip"
Centra Gas Manitoba Inc.,"Centra Gas Manitoba Inc., a subsidiary of Manitoba Hydro, is the primary distributor of natural gas in Manitoba, serving the Winnipeg and surrounding area, including rural communities. The company had a gas distribution monopoly in Manitoba until 1991.Based in Winnipeg, it is regulated by the Public"
Central Heat Distribution,"Creative Energy is a private district heating company. The company was founded on November 1, 1968, by group of engineers with a desire to lower heating bills for buildings (no boilers to buy and maintain) and to reduce the amount of pollution being created to provide heat downtown. In 2014, Central"
Central Mountain Air,"Central Mountain Air Ltd. is a Canadian regional airline based in Smithers, British Columbia. It operates scheduled, charter, and transborder services. Its main base is Smithers Airport, with other bases at Calgary International Airport and Vancouver International Airport."
CGI Group,"CGI Inc., also known as CGI Group Inc., is a Canadian multinational information technology (IT) consulting and systems integration company headquartered in Montreal, Quebec, Canada. The company went public in 1986 with a primary listing on the Toronto Stock Exchange. CGI is also a constituent of the"
Chapters,Chapter or Chapters may refer to:
CHC Helicopter,"CHC Helicopter is a large helicopter services company, specializing in the following services:

Transportation to offshore oil and gas platforms
Civilian search and rescue and air medical evacuation services
Helicopter maintenance repair and overhaulCHC Helicopter maintains it global headquarters in"
Choices Market,"Choices Markets is a grocer based in British Columbia, Canada, that is focused on natural, specialty and organic food.
The chain has ten stores: eight in Metro Vancouver, one in the Fraser Valley and one location in Kelowna. Choices Markets opened its 10th location, North Vancouver, in the second qu"
Chrysler Canada,"FCA Canada, Inc., formerly Chrysler Canada, is the wholly owned subsidiary of Stellantis through its North American division operating in Canada. Incorporated in 1925, the Chrysler Corporation of Canada acquired a Maxwell-Chalmers plant in Windsor, Ontario that had been used to manufacture some Chry"
CHUM Limited,"CHUM Limited was a Canadian media company based in Toronto, Ontario in operation from 1945 to 2007. The company was founded in 1945 as York Broadcasters Limited when it launched CHUM-AM 1050 but was acquired by salesman Allan Waters in 1954. CHUM had expanded to and owned 33 radio stations across Ca"
Cineplex Entertainment,"Cineplex Inc. (formerly Cineplex Galaxy) is a Canadian movie theatre and family entertainment centre chain headquartered in Toronto. 
The company was formed in 2003 via the acquisition of Loews Cineplex's Canadian operations (which included the assets of the former Cineplex Odeon chain) by Onex Corp"
Cirque du Soleil,"Cirque du Soleil (French: [siʁk dy sɔlɛj], Quebec [sɪʁk dzy sɔlɛj]; ""Circus of the Sun"" or ""Sun Circus"") is a Canadian entertainment company and the largest contemporary circus producer in the world. Located in the inner-city area of Saint-Michel, it was founded in Baie-Saint-Paul on 16 June 1984 by"
CityWest,"CityWest Cable and Telephone Corporation, operating as CityWest, is a municipally-owned telecommunications holding company which provides telephone, cable television, and internet services in Prince Rupert, British Columbia, Canada and the surrounding regions. CityWest also purchased Monarch Cablesy"
Coachman Insurance Company,"Coachman Insurance Company is a Canadian insurance company founded in 1979 and based in Ontario. Coachman was purchased by SGI Canada Insurance Services, a subsidiary of Saskatchewan Government Insurance, in 2001.Coachman serves the ""non-standard"" (high-risk) market for automobile insurance, such as"
Coast Capital Savings,"Coast Capital Savings Federal Credit Union (formerly Coast Capital Savings Credit Union) is a member-owned financial co-operative headquartered in Surrey, British Columbia. By membership, it is among the largest credit unions in Canada with 535,000 members and $25.2 billion in assets. Coast Capital "
Coffee Time,"Coffee Time is a chain of Canadian snack and coffee shops, headquartered in Scarborough, Ontario. Coffee Time operates over 100 stores across Canada in Ontario and Alberta. Coffee Time serves coffee along with other specialty drinks, baked goods, breakfast sandwiches, and deli sandwiches and soup."
Cognos,"Cognos Incorporated was an Ottawa, Ontario-based company making business intelligence (BI) and performance management (PM) software.  Founded in 1969, at its peak Cognos employed almost 3,500 people and served more than 23,000 customers in over 135 countries until being acquired by IBM on January 31"
Colt Canada,"Colt Canada (formerly called Diemaco) is the Canadian division of American firearms manufacturer Colt located in Kitchener, Ontario, Canada.
The facility produces small arms for the Canadian Armed Forces, Canadian law enforcement agencies In addition, the company exports firearms internationally. Kn"
Comm100,"Comm100 (Comm100 Network Corporation) is a provider of customer service and communication products. All its products are available as a SaaS (Software as a Service).  The company serves over 200,000 businesses."
Commodore Books,"Commodore Books is the first Black Canadian literary press in Western Canada. Founded in 2006 by Wayde Compton, Karina Vernon and David Chariandy, this press is dedicated to publishing work relevant to black people in Canada. 
Adventures in Debt Collection, by Vancouver-based author Fred Booker, is "
Conestoga-Rovers & Associates,"Conestoga-Rovers & Associates (CRA) is a group of companies that provides engineering, environmental consulting, construction, and information technology (IT) services.  On July 2, 2014 CRA became a division of the GHD Group.  Its current overall headquarters is located in Waterloo, Ontario, however"
Conexus Credit Union,"Conexus Credit Union is one of Saskatchewan's largest credit unions. Conexus has over $8 billion in consolidated assets, more than 120,000 members, and 30 branches across the province. More than 900 employees and sales professionals are located throughout the province."
Continental Newspapers,"Continental Newspapers, formally known as Continental Newspapers Canada Ltd., is a Canadian daily newspaper publisher based in Kelowna, British Columbia. It publishes two British Columbia dailies and The Chronicle-Journal of Thunder Bay, Ontario.
Continental is one of two Canadian newspaper companie"
Cookie Jar Group,"Cookie Jar Entertainment Inc. (also known as Cookie Jar Group and originally known as CINAR; renamed as DHX Cookie Jar Inc. from 2012 until 2014, or simply just Cookie Jar) was a Canadian media production and distribution company owned by DHX Media (now WildBrain). The company was first established "
Corby Spirit and Wine,"Corby Spirit and Wine Limited is a Canadian alcohol manufacturing and distribution company. It was founded in 1859 in Corbyville, Ontario. As of 2008, the company is 46% owned by Pernod Ricard.  The company distills several Canadian specialities, as well as marketing Pernod Ricard's products in Cana"
Cordiant Capital Inc.,"Cordiant Capital (commonly referred to as Cordiant) is a sector-focused investor in infrastructure private equity and private debt. The firm has offices in Montreal, London, Sao Paulo and Luxembourg and manages ~$2 billion on behalf of institutional investors."
Corel,"Corel Corporation ( kə-REL; from the abbreviation ""Cowpland Research Laboratory"") is a Canadian software company headquartered in Ottawa, Ontario, specializing in graphics processing. It is known for producing software titles such as CorelDRAW, and for acquiring AfterShot Pro, PaintShop Pro, Painter"
Corus Entertainment,"Corus Entertainment Inc. is a Canadian multinational mass media and entertainment conglomerate company headquartered at the Corus Quay in Toronto, Ontario. Formed in 1999 as a spin-off from Shaw Communications, it has prominent holdings in the radio, publishing, and television industries.
Corus has "
Cossette Inc.,"Cossette is a Canadian marketing communications company headquartered in Quebec City, Quebec.[1]
Cossette was initially launched as a graphic design firm by Claude Cossette in June 1964 under the name ""Cossette et associés, graphiste-conseils."" It was relaunched in May 1972 as ""Cossette Communicatio"
Coteau Books,"Coteau Books was a small, non-profit literary press based in Regina, Saskatchewan, Canada. It was established in 1975 by Bob Currie, Gary Hyland, Barbara Sapergia and Geoffrey Ursell when they realized that there was little opportunity for Saskatchewan writers to get published, especially first-time"
Cott,"Primo Water Corporation (formerly Cott Corporation) is an American-Canadian water company offering multi-gallon bottled water, water dispensers, self-service refill water machines, and water filtration appliances. The company is headquartered in Tampa, Florida, and services residential and commercia"
Country Style,"Country Style Food Services, Inc., formerly Country Style Donuts, is a fast/casual chain of coffee shops operating primarily in the Canadian province of Ontario (where it ranks second among coffee chains), which serves oatmeal, soup, sandwiches, salads, and coffee. The chain is based in Richmond Hil"
Creation Technologies,"Creation Technologies LP is a global electronics manufacturing services (EMS) provider headquartered in Boston, Massachusetts, USA.
Creation provides full service electronics solutions to a group of original equipment manufacturers (OEMs) across North America and Asia, and has 14 manufacturing opera"
Crestline Coach,"Crestline Coach Ltd. is an ambulance manufacturer located in Saskatoon, Saskatchewan, Canada, with offices in Alberta, Manitoba, Ontario, Quebec, and California. The company manufactures ambulances and specialty vehicles, and also distributes buses.  The company has manufactured vehicles that have b"
Expedia CruiseShipCenters,"Expedia Cruises is a travel agency franchise company established in 1987, specializing in marketing and sales of air, land & cruise vacations. Through its network of 300 independently owned retail locations and 7,000+ Vacation Consultants in North America, the company has year over year grown in sal"
CSA Group,"The CSA Group (formerly the Canadian Standards Association; CSA) is a standards organization which develops standards in 57 areas. CSA publishes standards in print and electronic form, and provides training and advisory services. CSA is composed of representatives from industry, government, and cons"
CTBC Bank (Canada),CTBC Bank (Chinese: 中國信託商業銀行; pinyin: Zhōngguó Xìntuō Shāngyè Yínháng) is amongst the largest privately owned banks in Taiwan.
CTV Television Network,"The CTV Television Network, commonly known as CTV, is a Canadian English-language terrestrial television network. Launched in 1961 and acquired by BCE Inc. in 2000, CTV is Canada's largest privately owned television network and is now a division of the Bell Media subsidiary of BCE."
Cymax Stores,"Cymax Group Technologies Ltd. is a privately held eCommerce company headquartered in Burnaby, British Columbia, Canada. The Cymax Group of brands includes two retail websites, Cymax Business and Home Square, which sell furniture and decor; plus Freight Club and Channel Gate, which are eCommerce logi"
Cyntech,"Cyntech Group provides high-capacity helical pile, helical rigid inclusion and pipeline anchor engineering and manufacturing services for industrial markets."
Dairyland Canada,"Dairyland is a dairy business that operates in Port Coquitlam, British Columbia. Now owned by Saputo Dairy Foods Canada, Dairyland was originally an operating arm of BC dairy farmers' cooperatives and was legally named Agrifoods International Cooperative Ltd. at the time of the sale of the majority "
Daiya,"Daiya Foods Inc. is a Canada-based dairy-alternative food company located in Burnaby, British Columbia. The company was established in 2008 by Andre Kroecher and Greg Blake. Daiya's original (and likely its best known) products are cheese analogues made from coconut oil and tapioca flour that are kn"
Dare Foods,"Dare Foods, Limited is a Canada-based food manufacturing company. They have seven factories in Canada and the United States. Their products are distributed in North America and at least 25 other countries."
Dart Flipcards,"Dart Flipcards Inc. is or was a Canadian company that markets a line of novelty Mini Lunch Boxes, with licensed images on them. Based out of St. Laurent, Quebec, Dart's lunch boxes are filled with chewing gum, made in Canada, inside Chinese made tins, and are packaged in Canada."
Delta Hotels,Delta Hotels by Marriott is a four-star brand of hotels and resorts located primarily in North America.
Descartes Systems Group,"The Descartes Systems Group Inc. (commonly referred to as Descartes) is a Canadian multinational technology company specializing in logistics software, supply chain management software, and cloud-based services for logistics businesses.
Descartes is perhaps best known for its abrupt and unexpected t"
Desjardins Group,"The Desjardins Group (French: Mouvement Desjardins) is a Canadian financial services cooperative and the largest federation of credit unions (French: caisses populaires) in North America. It was founded in 1900 in Lévis, Quebec by Alphonse Desjardins. While its legal headquarters remains in Lévis, m"
DHX Media,"WildBrain Ltd. (formerly DHX Media, Ltd.) is a Canadian media, production, and brand licensing company, mostly associated as an entertainment company. The company is known for owning the largest library of children's television programming, which is distributed through its multi-channel network, Wil"
Digital Extremes,"Digital Extremes is a Canadian video game developer founded in 1993 by James Schmalz. They are best known for creating Warframe, a free-to-play cooperative online action game, and co-creating Epic Games' Unreal series of games. Digital Extremes is headquartered in London, Ontario. In 2014, 61% of th"
Digitcom,"Digitcom Canada Inc. is a Canadian company that works in phone systems and data networks distributor. Primarily serving the greater Toronto, Montreal, and Southern Ontario small and midsize enterprise (SME) markets, Digitcom provides sales and support for telecommunications systems. Digitcom also ru"
Discovery Air Defence,"Top Aces Inc. is a Montreal, Quebec-based defence contractor that offers contracted airborne training services to the Canadian Armed Forces through the Contracted Airborne Training Services (CATS) program. Top Aces operates a fleet of modernized fighter aircraft to provide Red Air threat replication"
Discovery Air,"Discovery Air (DA), founded in 2004, was a specialized aviation company that operated primarily in Canada."
Dofasco,"ArcelorMittal Dofasco is a steel company based in Hamilton, Ontario, Canada. Dofasco is a standalone subsidiary of ArcelorMittal, the world's largest integrated steel producer."
Dollarama,Dollarama is a Canadian dollar store retail chain headquartered in Montreal. Since 2009 it is Canada's largest retailer of items for four dollars or less. Dollarama has over 1400 stores and has a presence in every province of Canada; Ontario has the most stores.
Dominion Voting Systems,"Dominion Voting Systems Corporation is a company that sells electronic voting hardware and software, including voting machines and tabulators, in the United States and Canada. The company's headquarters are in Toronto, Ontario, and Denver, Colorado. It develops software in offices in the United Stat"
Domtar,"Domtar Corporation is a Canadian company that manufactures and markets wood fiber-based paper and pulp product. The company operates pulp and paper mills in Windsor, Quebec, Dryden, Ontario, Kamloops, British Columbia, Ashdown, Arkansas, Hawesville, Kentucky, Plymouth, North Carolina, and Marlboro C"
Donner Metals,"Sphinx Resources Ltd. (formerly Donner Metals Ltd.) is a Canadian company focused on exploration of precious and base metals within mining rights in Quebec. It is listed on the TSX Venture Exchange. The company was formerly named Donner Metals Ltd., headquarters are in Vancouver, and active in other"
DreamCatcher Games,"DreamCatcher Interactive Inc. (also known as DreamCatcher Games) was a Canadian video game publisher founded in 1996 by Richard Wah Kan. In 2006, the company became a subsidiary of JoWooD Entertainment. In 2011, the company went into administration along with its parent JoWooD and all assets were pu"
