Company Name,Summary
New Flyer Industries,"New Flyer Industries is a Canadian multinational bus manufacturer, specializing in the production of transit buses. New Flyer is owned by the NFI Group, a holding company for several bus manufacturers. New Flyer has several manufacturing facilities in Canada and the United States that produce the co"
New York Fries,"New York Fries is a Canadian quick service restaurant that mainly serves french fries, hot dogs and poutine.
There are 120 locations in Canada, as well as locations in Bahrain, China, Egypt, Macao, Oman, Panama, Qatar, Saudi Arabia, Turkey & United Arab Emirates."
Nexen,"CNOOC Petroleum North America ULC, formerly known as Nexen, is a Canadian oil and gas company based in Calgary, Alberta.
Originally the Canadian subsidiary of US-based Occidental Petroleum (known as Canadian Occidental Petroleum or CanOxy), it became an independent company, Nexen, in 2000. Nexen was"
Nexient Learning,"Nexient Learning (formerly CrossOff Incorporated of Sydney, Nova Scotia) is one of the largest corporate training providers in Canada. Nexient Learning is based in Toronto, Ontario, and is a subsidiary of Global Knowledge of Cary, North Carolina. Nexient Learning trains over 100,000 students at all "
Nordion,"Nordion Inc., a Sotera Health company, is a health science company that provides Cobalt-60 used for sterilization and treatment of disease (radiotherapy). 
Nordion is headquartered in Ottawa, Ontario, Canada, with facilities in Vancouver, British Columbia and Laval, Quebec. Kevin Brooks is the compa"
Nortel,"Nortel Networks Corporation (Nortel), formerly Northern Telecom Limited, was a Canadian multinational telecommunications and data networking equipment manufacturer headquartered in Mississauga, Ontario, Canada. It was founded in Montreal, Quebec, in 1895 as the Northern Electric and Manufacturing Co"
North West Company,"The North West Company was a fur trading business headquartered in Montreal from 1779 to 1821.  It competed with increasing success against the Hudson's Bay Company in what is present-day Western Canada and Northwestern Ontario.  With great wealth at stake, tensions between the companies increased t"
Nova Chemicals,"NOVA Chemicals Corporation is a plastics and chemical company headquartered in Calgary, Alberta, with executive offices in the Pittsburgh suburb of Moon Township, Pennsylvania and Lambton County, Ontario.
NOVA Chemicals' products are used in a wide variety of applications, including food and electro"
Nova Scotia Power,"Nova Scotia Power Inc. is a vertically integrated electric utility in Nova Scotia, Canada. It is privately owned by Emera and regulated by the provincial government via the Nova Scotia Utility and Review Board (NSUARB). Nova Scotia Power Inc provides electricity to 520,000 residential, commercial an"
Novacam Technologies,Novacam Technologies Inc. specializes in designing and manufacturing advanced metrology and imaging systems for industrial and bio-medical applications. Novacam's fiber-based optical profilometers and Optical Coherence Tomography (OCT) systems are based on low coherence interferometry. The fiber-bas
Novosbed,"GoodMorning.com (formerly Novosbed) is a Canadian eCommerce mattress and sleep product company. Their products are manufactured and sold in both the United States and Canada.Sam Prochazka co-founded GoodMorning.com in 2009 to give consumers an alternative to what he refers to as ""the ubiquitously pu"
Nuu-chah-nulth Economic Development Corporation,"The Nuu-chah-nulth Economic Development Corporation (NEDC) was incorporated in 1984 under the Canada Corporations Act as a not-for-profit organization. Although it is not tied directly to the NTC, it was formed to help the Nuu-chah-nulth people achieve economic and social independence by providing f"
Ocean Productions,"Ocean Productions, Inc., is a Canadian media production and voice acting company based in Vancouver, British Columbia, that is part of the Ocean Group of businesses. Ocean Group is involved in intellectual property acquisition and development, co-production and the creation of English versions of an"
Oland Brewery,"Oland Brewery, formerly S. Oland & Sons, is a brewing company in Halifax, Nova Scotia, Canada (established 1907), which also acquired Alexander Keith's Brewery (1928), and is now owned by Labatt Brewing Company (1971), itself a unit of InBev. Sidney Oland (gt. grandson of Sidney C. Oland) served as "
Omineca Cablevision,"Omineca Cablevision was a cable television and internet service provider in Omineca Country, near Prince George, British Columbia. The company served the communities of Vanderhoof, Fraser Lake, and Burns Lake. The company takes its name from Omineca Country and the Omineca Mountains in the area. Omi"
Onex Corporation,"Onex Corporation is an investment manager founded in 1984. The firm manages capital on behalf of Onex shareholders, institutional investors and high net worth clients around the world.  As of December 31, 2020, Onex had approximately US$44 billion of assets under management."
Ontario Lottery and Gaming Corporation,"Ontario Lottery and Gaming Corporation (French: Société des loteries et des jeux de l'Ontario), known for corporate branding purposes simply as OLG since 2006, is a Crown corporation owned by the Government of Ontario, Canada. It is responsible for the province's lotteries, charity and Aboriginal ca"
OpenText,"OpenText Corporation (also written opentext) is a Canadian company that develops and sells enterprise information management (EIM) software.OpenText, headquartered in Waterloo, Ontario, Canada, is Canada's largest software company as of 2014 and recognized as one of Canada's top 100 employers 2016 b"
Osisko Mining,The Osisko Mining Corporation (formerly Oban Mining Corporation) is a Canadian company that conducts mineral exploration work with a focus on seeking to develop a gold mine in Ontario or Quebec. The company adopted its name following the 2015 merger of five companies that resulted in the re-uniting 
Ossian Studios,Ossian Studios Inc. is a developer of role-playing games for the Neverwinter Nights and Neverwinter Nights 2 franchise of PC games.
Pacific & Western Bank of Canada,"VersaBank is a Canadian chartered bank that was founded as a trust company in Saskatoon, Saskatchewan in 1980. It later moved its head offices to London, Ontario, and on August 1, 2002, it was granted a Schedule I Canadian chartered bank licence by the Canadian federal government, the first in appro"
Pacific Coastal Airlines,"Pacific Coastal Airlines Ltd is a Canadian regional airline that operates scheduled, charter and cargo services to destinations in British Columbia. Its head office is located in the South Terminal of Vancouver International Airport in Richmond, British Columbia. Its main base is Vancouver Internati"
Packers Plus Energy Services,"Packers Plus Energy Services, Inc. is a privately held, Calgary-based oil and gas service company. The company is the innovator of StackFRAC, an open hole multi-stage ball drop completion system. Packers Plus was founded in 2000 by Dan Themig, Ken Paltzat and Peter Krabben. Ian Bryant is president a"
PainCeptor Pharma,PainCeptor Pharma is a private Canadian company focused on the development of drugs that act outside the central nervous system on nociceptors to treat pain.  The company was established in 2004 through the merger of two academic spinout firms: Antalium from McGill University and NeuroCeptor from Qu
Palliser Furniture,"Palliser Furniture is a furniture manufacturing company headquartered in Winnipeg, Manitoba, Canada.In 2018, Peter Tielmann was appointed President and CEO of Palliser Furniture.  Art DeFehr was then appointed Chairman."
Pan American Silver,"Pan American Silver Corporation is a mining company based in Canada with operations in Latin America. The company has mines and other projects in Mexico, Peru, Bolivia, and Argentina.
It is one of the world's biggest silver producers; in 2017 the company extracted 25 million ounces of Silver, 160,00"
Panago,"Panago is a Canadian pizza delivery and takeout chain with about 200 locations across six provinces. It is a franchise business with each location being franchisee-owned and operated. In 2015, Panago generated over 150 million dollars in sales."
Paramount Resources,"Paramount Resources Ltd. is a Canadian petroleum company, founded in 1976. The company is involved in the exploration, development, production, processing, transportation and marketing of natural gas and its byproducts and crude oil. The company was founded by Clay Riddell.In addition to its own nam"
Parmalat Canada,"Lactalis is a French multinational dairy products corporation, owned by the Besnier family and based in Laval, Mayenne, France. The company's former name was Besnier SA.Lactalis is the largest dairy products group in the world, and is the second largest food products group in France, behind Danone. "
Parrish & Heimbecker,"Parrish & Heimbecker Limited is a Canadian grain company with about 1,500 employees across Canada and the northern United States. The company has several divisions including flour milling, feed milling, grain marketing, transportation and logistics.
It is a private, family-owned business founded in "
Pascan Aviation,"9736140 Canada Inc., doing business as Pascan Aviation, is a regional airline based in Longueuil, Quebec, Canada. Based at Montreal Saint-Hubert Longueuil Airport in the Saint-Hubert borough of Longueuil, Pascan operates scheduled flights within Quebec and Labrador as well as charter services. Its m"
Paterson GlobalFoods,"Paterson GlobalFoods (PGF) is a family-owned international agri-food business. It was established in 1908 as the N. M. Paterson Company.In 1912, N. M. Paterson built its first elevator at Fort William, with a handling capacity of 75,000 bushels. By 1928 the company, through construction and acquisit"
Persona Communications,"Persona Communications, formerly Regional Cablesystems, was a cable television, Internet and telecommunications provider in Canada.
Persona was purchased by EastLink in 2007. At that point it ceased to be an independent company, and the Persona name survived only as the brand name of some of EastLin"
Petcetera,"Petcetera was a pet specialty supply retailer founded in Richmond, British Columbia in 1997 by Dan Urbani. The chain had expanded to 49 stores and 1,600 employees across Canada, before filing for bankruptcy in 2009. A number of restructures followed until the final store was closed in 2014."
Petro-Canada,"Petro-Canada is a retail and wholesale marketing brand subsidiary of Suncor Energy. Until 1991, it was a federal Crown corporation (a state-owned enterprise). In August 2009, Petro-Canada merged with Suncor Energy, with Suncor shareholders receiving approximately 60 percent ownership of the combined"
Pharmasave,"Pharmasave is a Canadian independent pharmacy and drugstore retailer with over 800 stores across Canada. Pharmasave produces a line of over 700 private label, Pharmasave Brand products."
Pizza Nova,"Pizza Nova Take Out Ltd., doing business as Pizza Nova, is a Canadian franchise chain of pizza restaurants headquartered in Scarborough, Toronto. The chain was founded on 12 May 1963 by a young family of Italian immigrants. The first restaurant was located in the eastern Toronto suburb of Scarboroug"
Pizza Pizza,"Pizza Pizza Ltd. is a franchised Canadian pizza quick-service restaurant with its headquarters in Toronto, Ontario. Its restaurants are mainly in the province of Ontario while others are located in Quebec, Nova Scotia, New Brunswick and western Canada. Franchises in western Canada are mostly run thr"
Pollard Banknote,"Pollard Banknote Income Fund (TSX: PBL) traces its roots back to 1907 to the Saults & Pollard commercial printing company in Winnipeg, Manitoba, Canada. In the mid-1970s, the company made a move into security printing which entailed production of stamps, stocks, bonds and government documents. In th"
Porter Airlines,"Porter Airlines (stylized in all lowercase as porter) is a regional airline headquartered at Billy Bishop Toronto City Airport on the Toronto Islands in Toronto, Ontario, Canada. Owned by Porter Aviation Holdings, formerly known as REGCO Holdings Inc., Porter operates regularly scheduled flights bet"
Potash Corporation of Saskatchewan,"The Potash Corporation of Saskatchewan, also known as PotashCorp, was a company based in Saskatoon, Saskatchewan. The company merged with Calgary-based Agrium to form Nutrien, in a transaction that closed on January 1, 2018.The company was the world's largest potash producer and the third largest pr"
Prairie Plant Systems,"CanniMed Therapeutics Inc. is a Canadian public licensed producer of medical cannabis.  It is primarily focused on cannabis oil. The company's predecessor, Prairie Plant Systems, was established in 1988 and is located in Saskatoon, Saskatchewan.  In 2013 CanniMed became the first cannabis producer t"
Pratt & Whitney Canada,"Pratt & Whitney Canada (PWC or P&WC) is a Canada-based aircraft engine manufacturer.  PWC's headquarters are in Longueuil, Quebec, just outside Montreal.  It is a division of the larger US-based Pratt & Whitney (P&W), itself a business unit of Raytheon Technologies Corporation. United Technologies h"
Precision Drilling,"Precision Drilling Corporation  is the largest drilling rig contractor in Canada, also providing oil field rental and supplies."
Premium Brands Holdings Corporation,Premium Brands Holdings Corporation is a Canadian specialty food manufacturing and distribution company.  It is a publicly traded corporation on the Toronto Stock Exchange.
Prevost Car,"Prevost (, French pronunciation: ​[pʁevo]) is a Québec-based manufacturer of touring coaches and bus shells for high-end motorhomes and specialty conversions. The company is a subsidiary of Volvo."
Priszm,"Priszm LP was the largest operator of Canadian fast food restaurants. The Priszm Income Fund, an income trust, owns 60.2% of Priszm.
Priszm was one of the largest franchisees of Yum! Brands in the world, owning over 746 restaurants of various Yum!-owned chains in Canada, namely KFC, Pizza Hut, Taco "
Pronto Airways,"Pronto Airways LP was an airline formed in 2006 that was based in Saskatoon, Saskatchewan, Canada. 
It operated scheduled and charter passenger services as well as cargo service until the airline ceased operations in 2015. Its main bases were Prince Albert and Saskatoon, with destinations throughout"
Protecode,"Protecode was a private company based in Ottawa, Ontario, Canada that provided open source license and security management software used for software development license compliance.It was acquired by Synopsys in November 2015 for undisclosed terms."
Pultronics,"Pultronics inc. is a Canadian fabless semiconductor and software design house founded in 1994. It develops stand-alone electronic circuits, RFID tags (and readers), sensors and monitoring solutions. In addition it offers design services in several realms, ranging from microelectronics to custom IP s"
Purolator Courier,"Purolator Inc. is a Canadian courier that is 91% owned by Canada Post, 7% owned by Rainmaker Investments Ltd. and 2% by others.
The company was originally organized as Trans Canada Couriers, Ltd.  In 1967, it was acquired by the US manufacturer of oil and air filters Purolator of Fayetteville, North"
Quebecor,"Quebecor Inc. is a Canadian diversified media and telecommunications company serving Québec based in Montréal.  It was spelled Quebecor in both English and French until May 2012, when shareholders voted to add the acute accent, Québecor, in French only.The company was founded in 1965 by Pierre Pélad"
Quester Tangent Corporation,"Quester Tangent Corporation (QTC) is an independent North American supplier of train electronics and software for the rail transit industry. Quester Tangent designs, develops and manufactures vehicle monitoring hardware and software for the global rail transit industry, including monitoring and cont"
Recipe Unlimited,"Recipe Unlimited Corporation (formerly Cara Operations Limited) is a Canadian company that operates several restaurant chains such as Swiss Chalet, Harvey's and The Keg, and food distribution for large operations. The company's headquarters are in Vaughan, Ontario, in the Greater Toronto Area. In Ma"
Red Back Mining,"Red Back Mining Inc. is an unhedged Vancouver based mineral resource company. Its focus is West Africa where it operates the Chirano Gold Project in Ghana and the Tasiast Gold Mine in Mauritania.
It has one division, Red Back Mining NL, based in Perth, Australia.
While independent it was considered "
Red Barrels,"Red Barrels Inc. is a Canadian video game developer based in Montreal. The company was founded by Philippe Morin, David Chateauneuf and Hugo Dallaire in 2011. The three were previously developers for Ubisoft Montreal and EA Montreal, but founded the company after the origination of an original intel"
Regional Maple Leaf Communications,"Regional Maple Leaf Communications Inc (RMC) is a Canadian publishing company located in Edmonton, Alberta. The company specializes in community interest children's magazines distributed free of charge in select communities across Canada. RMC's five major annual publications are ""The Elementary Safe"
Reimer Express Lines,"Reimer Express Lines Ltd., which did business as YRC Reimer, was a Canadian less than truckload (LTL) carrier and subsidiary of YRC Worldwide based in Winnipeg, Manitoba. YRC retired the Reimer brand in 2019 merging it with YRC's largest LTL subsidiary, YRC Freight."
Resolute Forest Products,"Resolute Forest Products (French: Produits forestiers Résolu), formerly known as AbitibiBowater Inc., is a U.S.-domiciled, Canada-headquartered pulp and paper company. Headquartered in Montreal, Quebec, Resolute was formed in 2007 by the merger of Bowater and Abitibi-Consolidated. At the time, Abiti"
Richardson International,"Richardson International Limited is a privately held Canadian agricultural and food industry company headquartered in Winnipeg, Manitoba. The company is one of several companies that are owned by James Richardson & Sons Limited. The company is a worldwide handler and merchandiser of all major Canadi"
Rockstar Toronto,"Rockstar Games Toronto ULC (trade name: Rockstar Toronto; formerly Imagexcel, Alternative Reality Technologies, and Rockstar Canada) is a Canadian video game developer and a studio of Rockstar Games based in Oakville, Ontario. The company was established as Imagexcel in the early 1980s. The company "
Rockstar Vancouver,"Rockstar Vancouver Inc. (formerly Barking Dog Studios Ltd.) was a Canadian video game developer and a studio of Rockstar Games based in Vancouver. The company was founded as Barking Dog Studios in May 1998, by six developers formerly of Radical Entertainment. The company started out with developing "
Rogers Communications,"Rogers Communications Inc. is a Canadian communications and media company operating primarily in the fields of wireless communications, cable television, telephony and Internet, with significant additional telecommunications and mass media assets. Rogers has its headquarters in Toronto, Ontario. The"
Rona Inc.,"Rona, Inc. (stylized as RONA) is an American-owned Canadian retailer of home improvement and construction products and services. Founded in 1939, the company operates a mixture of company-owned and franchised retailers under multiple banners, including Rona, its big box formats Rona Home & Garden (R"
Roots Canada,"Roots Corporation (doing business as Roots) is a publicly held Canadian brand that sells apparel, leather bags, small leather goods, footwear, athletic wear, and home furnishings. The company was founded in 1973 by Michael Budman and Don Green. In 2015, Roots was sold to Searchlight Capital Partners"
Royal LePage,"Royal LePage is a Canadian real estate franchiser and owner-operator with more than 600 locations and over 18,000 Realtors in Canada.  The company was founded on July 2, 1913 in Toronto, Canada by then 26-year-old Albert E. LePage, under the name ""A.E. LePage, Bungalow Specialist."" In 1984, the comp"
Samuel Son & Co.,"Samuel, Son & Co. is a Canadian multinational company specializing in metal processing, distribution, and industrial products. As of 2018, the company has between 1,000-5,000 employees and is one of the largest processors and distributors of metal products in North America.[3][4][5]
Samuel, Son & Co"
Sandman Hotels,"Sandman Hotel Group is a Canadian hotel chain owned by Northland Properties. With the corporate headquarters based in Vancouver, British Columbia, Canada, the company currently has 47 properties across Canada under the brands Sandman Inns, Sandman Hotel & Suites, and Sandman Signature Hotels & Resor"
Sandvine,"Sandvine Incorporated is an application and network intelligence company based in Waterloo, Ontario.
Sandvine markets network policy control products that are designed to implement broad network policies, including Internet censorship, congestion management, and security. Sandvine's products target "
Saputo Inc.,"Saputo Inc. is a Canadian dairy company based in Montreal, Quebec, founded in 1954 by the Saputo family. It produces, markets, and distributes a wide array of dairy products, including cheese, fluid milk, extended shelf-life milk and cream products, cultured products and dairy ingredients and is one"
Saskatchewan Government Insurance,"Saskatchewan Government Insurance (SGI) is a Canadian insurance company and a Crown corporation wholly owned by the Government of Saskatchewan. SGI's operations consist of the Saskatchewan Auto Fund, the compulsory public auto insurance program for Saskatchewan, and its property and casualty insuran"
Saskatchewan Minerals,"Saskatchewan Minerals Inc. is a privately held company located in Saskatchewan, Canada, that mines and processes sodium sulphate.  Originally established as a crown corporation in 1947.  Today the company is one of the largest producers of anhydrous sodium sulphate in North America with production c"
SRC,SRC may refer to:
SaskPower,"Saskatchewan Power Corporation, operating as SaskPower, is the principal electric utility in Saskatchewan, Canada. Established in 1929 by the provincial government, it serves more than 538,000 customers and manages over $11.8 billion in assets. SaskPower is a major employer in the province with over"
SaskTel,"Saskatchewan Telecommunications Holding Corporation, operating as SaskTel, is a Canadian crown-owned telecommunications firm based in the province of Saskatchewan. Owned by the provincial government, it provides wireline and wireless communications services, including landline telephone, mobile netw"
Save-On-Foods,"Save-On-Foods is a chain of supermarkets located across Western Canada, owned by the Pattison Food Group.
Stores carry both standard brands and private label brands, such as Western Family. Many stores have a pharmacy, and some locations provide other services, including nutrition tours and health c"
Scotiabank,"The Bank of Nova Scotia (French: La Banque de Nouvelle-Écosse), operating as Scotiabank (French: Banque Scotia), is a Canadian multinational banking and financial services company headquartered in Toronto, Ontario. One of Canada's Big Five banks, it is the third largest Canadian bank by deposits and"
Sears Canada,"Sears Canada Inc. was a publicly-traded Canadian company affiliated with the American-based Sears department store chain. In operation from 1952 until January 14, 2018, and headquartered in Toronto, Ontario, the company began as Simpsons-Sears—a joint venture between the Canadian Simpsons department"
Second Cup,"Second Cup Café, is a Canadian restaurant chain, coffee retailer, and roaster which operates more than 190 cafes nationwide. Its headquarters are in Pierrefonds, Québec. Its stores sell hot and cold beverages, pastries, snacks, pre-packaged food items, hot and cold sandwiches, and drinkware, includi"
Sepro Mineral Systems,"Sepro Mineral Systems Corp. is a Canadian company founded in 1987 and headquartered in British Columbia, Canada. The outcome of the acquisition of Sepro Mineral Processing International by Falcon Concentrators in 2008, the companies' key focus is the production of mineral processing equipment for th"
Servus Credit Union,"Servus Credit Union is a member-owned, community-based financial institution based in Edmonton, Alberta, and in 2015 became the second largest credit union in Canada and the largest credit union in Alberta. Servus has around 380,000 members who are served by close to 2,400 employees from 100 locatio"
Shaftebury Brewing Company,"The Shaftebury Brewing Company is a craft brewery started in Vancouver, British Columbia in 1986. Shaftebury was sold to Sleeman Breweries in 1999. In 2014, the brand was sold to Fireweed Brewing Company, Tree Brewing.
Beers produced include Four Twenty Brilliant Lager, Coastal Cream Ale, Wet Coast "
Shaw Communications,"Shaw Communications Inc. is a Canadian telecommunications company which provides telephone, Internet, television, and mobile services. Headquartered in Calgary, Alberta, Shaw provides home telecommunications services primarily in Alberta and British Columbia and satellite television nationally. It a"
Shell Canada,"Shell Canada Limited (French: Shell Canada Limitée) is the subsidiary of British conglomerate Shell plc and one of Canada's largest integrated oil companies. Exploration and production of oil, natural gas and sulphur is a major part of its business, as well as the marketing of gasoline and related p"
