Company Name,Summary
D-Wave Systems,"D-Wave Systems Inc. is a Canadian quantum computing company, based in Burnaby, British Columbia, Canada. D-Wave was the world's first company to sell computers to exploit quantum effects in their operation.  D-Wave's early customers include Lockheed Martin, University of Southern California, Google/"
Dynamotive Energy Systems,"Dynamotive Energy Systems Corporation is a Canadian based Renewable Energy Company which specializes in fast pyrolysis, a process which creates a product named BioOil.  Its only other residue is char."
Dynamsoft,"Dynamsoft Corp. is a multinational software development company with its headquarter in Vancouver, Canada. It provides software development kit (SDK) for document capture and barcode applications for various usage scenarios. These SDKs help developers meet document imaging, scanning and barcode read"
DynaVenture,DynaVenture Corp. was formed in 2000 by second generation family members Brian and Earl Eidem and Jo-Ann Thompson. Founding father Harold Eidem started the 60 year dynasty in 1948 in his Vancouver home with his first business Bearing and Transmission Supply (B&T). In 1973 Harold Eidem set up B&T Hol
EA Black Box,"EA Black Box (formerly Black Box Games) was a video game developer based in Burnaby, British Columbia, Canada, founded in 1998 by former employees of Radical Entertainment and later acquired by Electronic Arts (EA). The developers are primarily known for the Need for Speed and Skate series. It was r"
EA Vancouver,"EA Vancouver (formerly known as EA Burnaby, then EA Canada) is a Canadian video game developer located in Burnaby, British Columbia. The development studio opened as Distinctive Software in January 1983, and is also Electronic Arts's largest and oldest studio. EA Vancouver employs approximately 1,30"
Ebco Industries,"Ebco Industries is a custom-manufacturing company based in Richmond, British Columbia. Ebco was founded by Helmut and Hugo Eppich in 1956 as a small Tool and Die shop, and it has subsequently expanded into a 300,000 sq. ft. manufacturing facility for domestic and international markets  providing:
he"
Elastic Path,"Elastic Path is a headless commerce system, allowing template-less eCommerce to be integrated as middleware into Enterprise ERP systems. The system is API based and is specifically targeted towards Enterprise level Organisations. Elastic Path is a private company based in Vancouver, British Columbia"
Electrohome,"Founded in 1907, Electrohome was Canada's largest manufacturer of television sets (TVs) from 1949 to 1984. The company was also involved in television broadcasting, and was a leader in data, video, graphics displays and projectors.
From 1984 to 1999, Electrohome-branded TVs were produced under licen"
EllisDon,"EllisDon is an employee-owned construction services company that was founded and incorporated in 1951 in London, Ontario, Canada, by brothers Don and David Ellis Smith. The company is headquartered in Mississauga, Ontario, Canada."
Emera,"Emera Incorporated is a publicly traded Canadian multinational energy holding company based in Halifax, Nova Scotia. Created in 1998 during the privatization of Nova Scotia Power, a provincial Crown corporation, Emera now invests in regulated electricity generation as well as transmission and distri"
Enbridge,"Enbridge Inc. is a multinational pipeline company headquartered in Calgary, Alberta, Canada. Over time, it has continued to grow through the acquisition of other existing pipeline companies and the expansion of their projects. It owns and operates pipelines throughout Canada and the United States, t"
Encana,"Ovintiv Inc. is a hydrocarbon exploration and production company organized in Delaware and headquartered in Denver, United States. It was founded and headquartered in Calgary, Alberta, and was the largest energy company and largest natural gas producer in Canada. The company was rebranded as Ovintiv"
Engineered Lifting Systems & Equipment,"Engineered Lifting Systems & Equipment Inc (ELS) is a Canadian manufacturing company specializing in standard and custom overhead material lifting systems and equipment. ELS was founded in by Jim Muir in Waterloo, Ontario and its headquarters is currently located in Elmira, Ontario."
Enwave,"Enwave Energy Corporation is a Canadian energy company headquartered in Toronto that provides sustainable district energy solutions including heating, cooling, hot water, combined heat and power, geoexchange, energy storage, sewer heat, waste-to-energy, biomass, solar energy systems. It is one of th"
Esprida,"Esprida is a privately held company that creates and markets remote device management middleware built on a service-oriented architecture (SOA) platform.
Esprida software enables communication between devices and users via the Internet. From a single computer, a user is able to send and receive mess"
F&P Manufacturing Inc.,"F&P Manufacturing Inc. abbreviated F&P Mfg Inc. is a Japanese automotive parts supplier based in North America. They make components such as subframes, trailing arms, Lower Arm and Pedals for Honda, Toyota and General Motors vehicles. F&P Mfg inc. operates plants in Tottenham, Ontario, Canada and St"
Fairchild Group,"The Fairchild Group (traditional Chinese: 新時代集團; simplified Chinese: 新时代集团; pinyin: Xīnshídài Jítuán; Jyutping: San1si4doi6 Zaap6tyun4) is a Canadian business conglomerate, with headquarters in Vancouver, British Columbia, Canada. Fairchild Group operates various media properties under the Fairchild"
Fairchild TV,"Fairchild TV or FTV is a Canadian Cantonese language exempt specialty channel. It is owned by Fairchild Group, with Hong Kong broadcaster TVB holding a 20% minority stake. Fairchild TV has studios in the Greater Toronto Area (Richmond Hill, Ontario) and Greater Vancouver (inside Aberdeen Centre in R"
Fairfax Financial,"Fairfax Financial Holdings Limited is a financial holding company based in Toronto, Ontario, which is engaged in property, casualty, insurance and reinsurance, investment management, and insurance claims management. The company operates primarily through several subsidiaries, including Allied World,"
Fairmont Hotels and Resorts,"Fairmont Hotels & Resorts is a global chain of luxury hotels that operates more than 70 properties worldwide, with a strong presence in Canada.The company originated from two hotel businesses established in the late 19th century, the Canadian Pacific Limited owned Canadian Pacific Hotels & Resorts, "
Falconbridge Ltd.,"Falconbridge Limited was a Toronto, Ontario-based natural resources company with operations in 18 countries, involved in the exploration, mining, processing, and marketing of metal and mineral products, including nickel, copper, cobalt, and platinum. It was listed on the TSX (under the symbol FAL.LV"
Farmers of North America,"Farmers of North America (""FNA""), incorporated as Farms and Families of North America Inc., has been characterized as a volume-buyer group, but that function is only one of its strategies for meeting its mission, ""Maximizing Farm Profitability.""
Recent examples unrelated to ""volume buying"" widely re"
Federated Co-operatives,"Federated Co-operatives Limited (FCL), operating as Co-op, is a co-operative federation providing procurement and distribution to member co-operatives in Western Canada. It was established in 1944 after a series of amalgamations of smaller cooperatives, starting in Saskatchewan, including the Saskat"
Federated Insurance Company of Canada,"Federated Insurance Company of Canada (""Federated Insurance"") is a direct writer of property and casualty insurance products headquartered in  Winnipeg, Manitoba, Canada. The Company has approximately 370 employees in nine offices across Canada, with approximately 150 in Winnipeg. Federated Insuranc"
FGL Sports,"FGL Sports Ltd. is a Canadian sporting goods retailer based in Calgary, Alberta. It operates under these corporate banners: Sport Chek, Atmosphere (renamed from Coast Mountain Sports), Sport Mart (all stores closed as of March 2013), National Sports, Pro Hockey Life, Athletes World (all stores close"
Fido Solutions,"Fido Solutions Inc. is a Canadian cellular telephone service provider owned by Rogers Communications Canada. Although Fido's parent company, Rogers Communications, also operates another cellular service Rogers Wireless, Fido remains a separate entity and retains its own retail chain, customer servic"
Finning,"Finning is the world's largest Caterpillar dealer, selling, renting and providing parts and service for equipment and engines to customers across diverse industries, including mining, construction, petroleum, forestry and a wide range of power systems applications.
Finning employs more than 13,000 p"
First Air,"Bradley Air Services Limited, operating as First Air, was an airline headquartered in Kanata, a suburb of Ottawa, Ontario, Canada. It operated services to 34 communities in Nunavut, Nunavik, and the Northwest Territories. First Air has assisted in various humanitarian missions such as the 2010 Haiti"
First Majestic Silver,"First Majestic Silver Corp. is a Canadian silver-mining company that operates in Mexico and the United States. It has four producing mines under its control: San Dimas Silver/Gold Mine, Santa Elena Silver/Gold Mine, La Encantada Silver Mine, and Jerritt Canyon Gold Mine. First Majestic also produces"
First Nations Bank of Canada,First Nations Bank of Canada (FNBC) (French: La Banque des Premières Nations du Canada) is the first Canadian chartered bank to be independently controlled by Indigenous shareholders.  FNBC is a Schedule 1 Federally Regulated Bank in accordance with the Bank Act and received its charter on 19 Novemb
First West Credit Union,"First West Credit Union (First West) is British Columbia’s third largest credit union with nearly $16.9 billion in total assets and assets under administration and more than 250,000 members. Its core business is traditional banking, the provision of personal and business daily banking services. Firs"
Flickr,"Flickr ( FLI-kər; pronunciation ) is an American image hosting and video hosting service, as well as an online community, founded in Canada and headquartered in the United States. It was created by Ludicorp in 2004 and was a popular way for amateur and professional photographers to host high-resolut"
Force Four Entertainment,"Force Four Entertainment is a Canadian film and television production company based in Vancouver.Force Four Entertainment began operations in 1983, and has now produced more than 500 hours of primetime broadcast programming, earning accolades on the national and international stage.
The company’s te"
Ford Motor Company of Canada,"Ford Motor Company of Canada, Limited (French: Ford du Canada Limitée) was founded on August 17, 1904, for the purpose of manufacturing and selling Ford automobiles in Canada and the British Empire. It was originally known as the Walkerville Wagon Works and was located in Walkerville, Ontario (now p"
Fort Garry Brewing Company,"The Fort Garry Brewing Company Ltd is a brewery in Winnipeg, Manitoba, Canada."
Fortis Inc.,"Fortis Inc. is a St. John's, Newfoundland and Labrador-based international diversified electric utility holding company. It operates in Canada, the United States, Central America,  and the Caribbean. In 2015, it earned $6.7 billion CAD.Fortis was formed in 1987, when shareholders of the regulated tr"
FortisBC,"FortisBC is an electricity and natural gas distribution utility in the Canadian province of British Columbia, a subsidiary of Newfoundland-based Fortis Inc., Canada’s largest private utility company. In March 2011, Terasen Gas, British Columbia's largest natural gas distributor, was renamed FortisBC"
Four Seasons Hotels and Resorts,"Four Seasons Hotels Limited, trading as Four Seasons Hotels and Resorts, is an international luxury hotel and resort company headquartered in Toronto, Ontario, Canada. Four Seasons operates more than 100 hotels and resorts worldwide. Since 2007, Bill Gates (through Cascade Investment) and Prince Al-"
French Shoes,"French Shoes was a shoe chain headquartered in Montreal, Quebec. It began in 1956, with its last location closing in the 1990s. 
French Shoes featured stylish and affordable women's shoes, growing to 30 locations throughout the provinces of Quebec and Ontario. 
The founder of French Shoes was Seymou"
Freedom Mobile,"Freedom Mobile Inc. is a Canadian wireless telecommunications provider owned by Shaw Communications. It has 6% market share of Canada, mostly in urban areas of Ontario, British Columbia and Alberta. Freedom Mobile is the fourth-largest wireless carrier in Canada, with 2,188,845 subscribers as of Feb"
FreshBooks,"FreshBooks is accounting software operated by 2ndSite Inc. primarily for small and medium-sized businesses. It is a web-based software as a service (SaaS) model, that can be accessed through a desktop or mobile device.
The company was founded in 2003 and is based in Toronto, Canada."
Freshslice Pizza,Freshslice Pizza is a Canadian pizza chain and franchise founded by Ray Russell in 1999. The franchise owns 77 branches across Canada. They are known for their pizza by the slice.
Ganz,"The Ganz Works or Ganz (Hungarian: Ganz vállalatok or Ganz Művek, Ganz companies, formerly Ganz and Partner Iron Mill and Machine Factory) was a group of companies operating between 1845 and 1949 in Budapest, Hungary. It was named after Ábrahám Ganz, the founder and the manager of the company. It is"
Garage,Garage may refer to:
General Motors Canada,"General Motors of Canada Company (French: La Compagnie General Motors du Canada), commonly known as GM Canada, is the Canadian subsidiary of General Motors. It is headquartered in Oshawa, Ontario, Canada.
In the aftermath of the 2008 financial crisis, GM Canada received a combined loan commitment of"
Geosoft,"Geosoft Incorporated is a software development and services company headquartered in Toronto, Canada.  The company provides geophysical and geological software and geospatial server technology for professional geoscientists involved in natural resource exploration and related earth science disciplin"
Giant Tiger,"Giant Tiger Stores Limited is a Canadian discount store chain which operates over 260 stores across Canada. The company's stores operate under the Giant Tiger banner in Alberta, Manitoba, New Brunswick, Nova Scotia, Ontario, Prince Edward Island and Saskatchewan; under the GTExpress and Scott's Disc"
Glacier Media,"Glacier Media is a Canadian business information and media products company. It provides news, market information and sector-specific data within North America and internationally.
Glacier is headquartered in Vancouver. Its primary operations are in Canada as well as London, England. It is publicly "
Glentel,"Glentel is a Canadian retail firm. Based in Burnaby, the company deals primarily as a retailer of mobile phone services; in Canada, the company operates over 350 wireless outlets under the Tbooth Wireless (La cabine T sans-fil in Quebec, formerly The Telephone Booth) and WIRELESSWAVE (Wave sans fil "
Global Mechanic,"Global Mechanic Media is an interdisciplinary creative studio headquartered in Vancouver, British Columbia, Canada.  It is known for creating various digital and traditional media, feature and short films, television series, commercials, games, installations, interactive experiences, titles, and ori"
GlobeScan,"GlobeScan is a global insights and advisory consultancy. GlobeScan's evidence-based approach generally relies on polling amongst the general public and targeted stakeholders according to the scope of their clients project. Since July 2004, GlobeScan has been a signatory to the United Nations Global "
Goldcorp,"Goldcorp Inc. was a gold production company headquartered in Vancouver, British Columbia, Canada. The company employed about 15,800 people worldwide, engaged in gold mining and related activities including exploration, extraction, processing and reclamation. Goldcorp’s operating assets included four"
GoodLife Fitness,"Goodlife Fitness Centres Inc. is the largest health club company in Canada with over 450 locations across the country, under the banner of four brands."
Great Western Brewing Company,"The Great Western Brewing Company is an independent brewery in Saskatoon, Saskatchewan, Canada.  The company currently produces several varieties of beer and hard seltzer, some of which have received international awards for excellence. With annual production capabilities of >300,000 hectolitres ann"
Groupe Dynamite,"Groupe Dynamite is a Canada-based clothing company founded in 1975 as The Garage Clothing Company. The company creates, designs, markets and distributes from its head office in Montreal, Quebec, and operates over 300 stores across in Canada and the United States, with more than 4,300 employees.In Se"
Guardian Biotechnologies,"Guardian Biotechnologies Inc. is a privately owned plant biotechnology company, founded in August 2002, that operates from its corporate headquarters in Saskatoon, Saskatchewan, Canada."
GuestLogix,"Guestlogix Inc. is a Toronto-based technology company that provides onboard and off-board retail technology and merchandising systems. It was listed on the Toronto Stock Exchange, after being initially listed on the Toronto Venture Exchange in 2007. In February 2016, it entered creditor protection, "
Halogen Software,"Halogen Software was a Canadian company that provided cloud-based talent management solutions to customers with between 100 and 10,000 employees. The firm was founded in 1996 and was headquartered in Ottawa, Ontario, Canada."
Harbour Publishing,"Harbour Publishing is a Canadian independent book publisher.
The company was founded in 1974 by Howard and Mary White, and is based in Pender Harbour, a small town on British Columbia's Sunshine Coast. Harbour mainly publishes books on British Columbian history, culture, wildlife and environment. To"
Harlequin Enterprises,"Harlequin Enterprises ULC (known simply as Harlequin) is a romance and women's fiction publisher founded in Winnipeg, Canada in 1949. From the 1960s, using a combination of high-quality editorial content and dynamic marketing, it grew into the largest publisher of romance fiction in the world. Based"
Harry Rosen Inc.,"Harry Rosen Inc. is a Canadian retail chain of 17 luxury men's clothing stores. A privately owned company, Harry Rosen accounted for 40 percent of the Canadian market in high-end menswear in 2008.Founded by Harry Rosen in 1954, as a single 500-square-foot (46 m2) store in Cabbagetown, Toronto, Harry"
Hart Stores,"Hart Stores Inc. is a mid-sized value-driven department store in Eastern Canada. It was founded in 1960 by Harry Hart, in Rosemère, Quebec. Hart stores is based in the provinces of Quebec, New Brunswick, and Ontario. The head office used to be in the Montreal borough of Anjou but moved to Laval, Que"
Harvey's,"Harvey's is a fast food restaurant chain operating in Canada, with locations in every province. It serves hamburgers, poutine, hot dogs, french fries, onion rings, and other traditional Canadian fast-food fare. The chain is owned by Recipe Unlimited (previously known as Cara Operations).Harvey's is "
Hatch Ltd,"Hatch is a global multidisciplinary management, engineering and development consultancy. Its group companies have more than 9,000 staff in 70+ offices. In 2015, Hatch was ranked as a top 20 International Design Firm according to the Engineering News-Record (ENR) rankings.The company was founded in T"
Hathor Exploration,"Hathor Exploration Limited is a uranium exploration company based in Vancouver, British Columbia, Canada. Its exploration office is located in Saskatoon, Saskatchewan, Canada. Hathor's exploration projects concentrate on properties within the Athabasca Basin of Northern Saskatchewan, Canada.In 2009,"
Haywire Winery,"Haywire Winery is a Canadian Winery located in the Okanagan Valley’s Summerland, British Columbia.  Situated on a 10 acre lot, Haywire sits looking over Okanagan Lake."
Hellbent Games,"Hellbent Games Inc. is a Canadian video game developer based in Burnaby, British Columbia. The company was founded by Christopher Mair, a founder of Rockstar Vancouver, on 12 June 2006, in Vancouver, British Columbia."
Héroux-Devtek,"Héroux-Devtek Inc. is an international company specializing in the design, development, manufacture, repair and overhaul of landing gear, actuation systems and components for the aerospace market. Founded in 1942, the company's head office is located in Longueuil, Quebec. Héroux-Devtek Inc. has more"
Hidden Valley Highlands,"Hidden Valley Highlands Ski Area is a ski and snowboard resort in Huntsville, Ontario, Canada. Hidden Valley offers 15 groomed trails, three quad chairlifts, one handle tow, two snow cats, night skiing and snowboarding, and a terrain park."
Home Hardware,"Home Hardware Stores Ltd. is a privately held Canadian home improvement, construction materials, and furniture retailer. Co-founded in 1964 by Walter Hachborn and headquartered in St. Jacobs, Ontario, the chain is co-operatively owned by over 1100 independently owned member stores, including one of "
Honda Canada Inc.,"Honda Canada Inc. is the Canadian division of the Honda Motor Company. Founded in 1969, Honda has been building cars in Canada since 1986 in Alliston, Ontario and head office in Markham, Ontario."
HSBC Bank Canada,"HSBC Bank Canada (French: Banque HSBC Canada), formerly the Hongkong Bank of Canada (HBC), is the Canadian subsidiary of British multinational banking and financial services company HSBC. HSBC Canada is the seventh largest bank in Canada, with offices in every province except Prince Edward Island, a"
Hudbay Minerals,"Hudbay Minerals Inc. is a diversified Canadian mining company primarily producing copper concentrate (containing copper, gold, and silver) and zinc metal. Much of its history has centered on Flin Flon, Manitoba, where it has mined for over 90 years. Hudbay currently has operations in Manitoba and Pe"
Hudson Boatworks,"Hudson Boat Works is a rowing racing shell manufacturer based in London, Ontario. Jack Coughlan and his brother-in-law Hugh Hudson founded the company in 1981. In March 2007, Hudson began production of their ""Shark"" line of boats.  Designed by Britt Chance, US Naval Architect, Luis Tarrataca, Hudson"
Hudson's Bay Company,"The Hudson's Bay Company (HBC; French: Compagnie de la Baie d'Hudson) is a historically Anglo-Canadian but now American-owned retail business group. A fur trading business for much of its existence, HBC now owns and operates retail stores in Canada and the United States.In 2006, an American business"
Husky Energy,"Husky Energy Inc. is a company engaged in hydrocarbon exploration, headquartered in Calgary, Alberta, Canada. It operates in Western and Atlantic Canada, the United States and the Asia Pacific region, with upstream and downstream business segments. In the 2020 Forbes Global 2000, Husky Energy was ra"
Hydro-Québec,"Hydro-Québec is a public utility that manages the generation, transmission and distribution of electricity in the Canadian province of Quebec, as well as the export of power to portions of the Northeast United States.
It was established by the Government of Quebec in 1944 from the expropriation of p"
IGM Financial,"Power Corporation of Canada (French: Power Corporation du Canada) is a management and holding company that focuses on financial services in North America, Europe and Asia. Its core holdings are insurance, retirement, wealth management and investment management, including a portfolio of alternative i"
IL Therapeutics,"IL Therapeutics Inc. was previously owned by Western Life Sciences Venture Fund LP
(""Western Life Sciences"") and in 2006 its shares were purchased by Pacgen Biopharmaceuticals Corporation (""Pacgen"")."
IMAX Corporation,"IMAX Corporation is a Canadian theatre company which designs and manufactures IMAX cameras and projection systems as well as performing film development, production, post-production and distribution to IMAX-affiliated theatres worldwide. Founded in Montreal in 1967, it has headquarters in the Toront"
Immersive Media,"Immersive Media Company (IMC) is a digital imaging company specializing in spherical immersive video.  The parent company Immersive Ventures is headquartered in Kelowna, British Columbia with Immersive Media Company offices in Dallas, Texas."
ImmersiVision,"ImmersiVision Interactive Technologies Inc. is a Whistler, British Columbia, Canada based company, founded in early 2004, whose primarily revenue source was the production of immersive virtual reality.  The product is similar to Google Streetview. The Immersive media is a mixture of both indoor and "
Imperial Oil,Imperial Oil Limited (French: Compagnie Pétrolière Impériale Ltée) is a Canadian petroleum company. It is Canada's second-biggest integrated oil company.It is majority owned by American oil company ExxonMobil with around 69.6 percent ownership stake in the company. It is a significant producer of cr
Indigo Books and Music,"Indigo Books & Music Inc., known as ""Indigo"" and stylized ""!ndigo"", is a Canadian bookstore chain. It is Canada's largest book, gift, and specialty toy retailer, operating stores in all ten provinces and one territory, and through a website offering a selection of books, toys, home décor, stationery"
Information Services Corporation,"Information Services Corporation (ISC) is a publicly traded Saskatchewan business corporation responsible for the development, management and administration of: registries – land titles, personal property, corporate and survey registries; geographic information; and access to government services for"
